step,reason,short_reason,number_dropped,n_rows,order
doc harmonization,Starting dataset,Starting,0,2583192,0
doc harmonization,Dropped rows while cleaning approximate values,Clean approximates,0,2507751,4
doc harmonization,"Dropped rows indicating fails, missing data, etc.","Fails, etc.",75441,2507751,2
doc harmonization,Dropped rows while filtering fraction types,Fraction types,756605,433845,7
doc harmonization,Dropped rows while harmonizing units,Harmonize units,19245,2488506,5
doc harmonization,Dropped rows while cleaning MDLs,Clean MDLs,0,2507751,3
doc harmonization,Filtered for only water media,Water media,0,2583192,1
doc harmonization,Dropped rows while aggregating analytical methods,Analytical methods,1298056,1190450,6
